{
  "uid": "bc6f6de3-9901-4007-976b-46ea66e9a699",
  "name": "attribute1 to attribute2",
  "version": "1.0.0",
  "physicalEntityAssocation": "d042b292-7c81-408a-ad43-49833ca804c1",
  "sourceTargetAttributeLinks": [
    { "transformation" : {
      "uid" : "df439fcf-bd8a-4707-ab93-2aed47e4d28d",
      "from" : [ "d042b292-7c81-408a-ad43-49833ca804c1", "df439fcf-bd8a-4707-ab93-2aed47e4d28d" ],
      "to": "ed2359d8-9bc8-4fc8-bc6e-d4a2385efcc0",
      "description": "Fields are concatenated with a space character",
      "formula": "{{d042b292-7c81-408a-ad43-49833ca804c1}} + ' ' + {{df439fcf-bd8a-4707-ab93-2aed47e4d28d}}"
    }
    }
  ]
}
